{
  "schema_version": "2.0",
  "branch": "Vu Su Tu Thai Duong Chi Tu",
  "chapter": 65,
  "chapter_id": "chapter_0065",
  "source_manifest_hash": "673b8b69e287fb3b5c4a9ad3acbe83f64f04ccf1efdaf77238d6f4738d99e732",
  "aligned_segments": [
    {
      "alignment_id": "chapter_0065:align_0001",
      "chapter_id": "chapter_0065",
      "segment_ids": [
        "chapter_0065:seg_0001"
      ],
      "source": "第65章 骑士想法\n一座高大宏伟的灰黑色城堡占据了整个城池的中央。城堡周围是一圈高大的围墙，相较于城池的城墙，城堡的防护明显要高上一个等级。\n马车上的格林，环视了一下四周的环境，城堡周围没有什么建筑，特意空了出来，让哨兵能够拥有更加宽阔的视野。城堡的上方，还可以看到耸立的黑色哨塔，哨塔的排列很密集，整个城堡戒备森严。\n城堡上灰黑色的石砖，以及不时出现的青苔，散发出厚重的历史。\n“这城堡建的还不错！”格林赞叹一声。\n“能够得到巫师大人的赞美，是我的荣幸！”一个平稳而温和的语气传来，格林循着声音望去。是城堡大门处的一个中年男人，穿着一身白色镶金的大衣。\n中年男人看见格林的目光，马上低头走到格林的马车旁。\n“巫师大人，欢迎您来到威瑟城，这里是我的领地，我是这一片地区的公爵，您叫我里恩就行了！”公爵的样子非常谦卑，一脸微笑的说道。\n“很高兴见到你，里恩公爵。我是学院这一任的驻守巫师格林，接下来的5年，我将会驻守在这里！”格林淡淡的回应道。\n“劳烦格林大人了，我已经为您准备好了宴席，请进吧！”里恩对着格林邀请道。\n格林自然不会拒绝，下了马车，将马车交给士兵，并且嘱咐他们不要乱动，只需要给马匹喂养草料后，就跟着里恩一起进入了城堡。除了克拉多继续跟着公爵进入了城堡，之前一直开道和随行的卫队在城堡入口散开，回到了各自的岗位上。围绕在队伍身旁的，变成了一大群女仆。\n一行人进入城堡的接客大厅，格林就发现，城堡的接客大厅明显经过精心的布置。\n城堡大厅的地面被擦拭的一尘不染，甚至可以倒映出人的脸庞。巨大的金色吊灯被挂在大厅的正中央，上面摆满了特殊的荧光石，将整个大厅照亮。\n大厅的旁边还有着专业的乐队，正在演奏着舒缓的音乐，给人一种宁静悠远的感觉。\n大厅中央的宴会桌上，摆满了丰富的食物，肉香和酒香四溢，银色的酒壶，在金色吊灯的照耀下，反射出金灿灿的光辉。\n数量极多的女仆站在大厅的各个地方，准备随时为宴会上的人进行服务。\n除此之外，还有一队人站在大厅中央，看样子都是公爵的家属，或者城堡之中的其他贵族以及核心人员。\n“格林大人，请上座吧！”李恩公爵恭敬的将格林请入了宴席当中。\n已经赶路了很久的格林，也想要吃一点正常的食物，自然是欣然入座。\n格林吃饭时并不喜欢说话，其他人也不敢进入引入话题，整个餐厅的氛围，显得有些沉闷。格林倒是乐在其中，享受美食的时候就是不应该说话。\n里恩公爵，看着正在享受美食的格林，眼底的不安稍稍的放下去了一些。\n［这次的巫师，看样子比之前的要好伺候很多！］里恩看着格林默默的评价了一句。\n“格林大人！您能收我为徒吗？”一道稍显的声音，打破了整个宴会上的沉默。\n所有人都望向声音的来源，是一个有着一头金色长发，皮肤白皙，身形丰满，年龄看上去不过十五六岁的女孩。\n里恩公爵以及宴会上的其他年纪较大众人，脸上露出了惊恐的表情，作为接触过巫师的人，绝大多数的巫师都看不起普通的凡人，凡人随意跟巫师交流，是一种风险极大的事情。\n“艾莉西亚，你在说什么呢？快向格林大人道歉！”坐在女孩旁边一个身姿绰约，面容成熟的中年女人，马上把艾莉西亚拉了起来，面容恐慌的拉着艾莉西亚不断的向格林鞠躬道歉。\n“为什么想要拜我为师？”已经吃的差不多的格林，拿起旁边的餐巾，擦了擦嘴，有些好奇的问向艾莉西亚。\n在来到餐桌上的第一时间，格林就发现了艾莉西亚的异常，一直在说与不说之间纠结，直到看见格林已经快要结束用餐时，还不得不硬着头皮站起来说道。\n艾莉西亚听到格林的声音，脸上先是露出了一丝慌乱和为难，随后便是喜悦。\n“我……”艾莉西亚正要说出自己的原因，却突然眼光一瞥，看向了公爵，随后又看向自己旁边还在鞠躬的女人，随后眼神黯淡起来。不过艾莉西亚的犹豫只在一瞬间，她像是下定了什么决心，深吸了一口气。\n“格林大人，我想掌握自己的命运，不想作为政治联姻的牺牲品！”艾莉西亚的眼神带着绝望与希望说出这句话。\n现在她的命运，几乎完全交给了格林决定。一旦格林不进行干扰，她连同她的家人最终的命运就是被赶出城堡。\n格林看着艾莉西亚，像是想起了艾希维尔。在男爵领地，艾希维尔不断的靠近他，也是相同的目的，不愿意成为政治联姻的牺牲品。\n“我不可能收你为徒，你并没有巫师资质！”格林的一句话，直接把艾莉西亚打入了深渊。原本星星点点的眼睛，瞬间变得暗沉起来。整个人的精气神，都像是被抽走一样。\n“没关系，谢谢格林大人。”艾莉西亚像是木头一样，僵硬的坐在了椅子上。\n宴会上的公爵，也稍稍的松了一口气，看了一眼格林后，用危险的眼光看着艾莉西亚。\n“不过如果你愿意配合我的实验，我倒是可以把你培养成一个大骑士！”满足了心中的恶趣味，格林突然又开口道。\n不过受到重大打击的艾莉西亚，像是没有听见格林的话，人就像是一个木头人一样，呆呆的坐在座位上。直到旁边的贵妇，轻轻拍打了她的脸庞，艾莉西亚才回过神来，一脸惊喜的看向格林。\n“我愿意，我愿意配合大人的实验！”艾莉西亚神色激动的回答，还不停的向格林鞠躬。\n“那就先这样吧，我的实验室建立起来了后，会通知你的！”格林淡淡的说道。\n这并不是格林的临时起意，而是预先就想好的研究。\n大骑士上面，是传说中的圣骑士，风暴呼吸法上，并没有记载相关的突破方法，只能靠格林研究。\n让格林奇怪的是，就算是在巫师大陆，以及格林搜集的其他凡人大陆的资料上，都没有关于圣骑士的记载，仿佛圣骑士只在格林之前的奥斯菲尔大陆上存在过。\n但在奥斯菲尔大陆上，关于圣骑士的记载并不少，甚至还很多，奥斯菲尔有名的帝国，似乎都曾经诞生过圣骑士，只不过不知道因为什么原因，突然失去了传承，奥斯菲尔大陆再也没有诞生过的圣骑士。\n这几年时间，刚好自己能够进行的研究不多，加上材料的短缺，刚好可以进行关于圣骑士的研究。",
      "source_hash": "4e7fcd8262b999a833ece522a1f57aeb5e77f1d1190b49f6ed522a0369d01c36",
      "target": "Chương 65 Ý tưởng về kỵ sĩ\nMột tòa lâu đài màu xám đen cao lớn hùng vĩ chiếm giữ vị trí trung tâm của toàn bộ thành trì. Xung quanh lâu đài là một vòng tường thành cao lớn, so với tường thành của thành trì thì phòng hộ của lâu đài rõ ràng là cao hơn một cấp.\nGrimm ngồi trên xe ngựa nhìn quanh môi trường xung quanh. Xung quanh lâu đài không có kiến trúc nào khác, cố ý để trống để lính gác có tầm nhìn rộng hơn. Phía trên lâu đài còn có thể nhìn thấy những tháp canh màu đen sừng sững, các tháp canh được bố trí rất dày đặc, toàn bộ lâu đài canh gác vô cùng cẩn mật.\nNhững viên gạch đá màu xám đen trên lâu đài cùng với rêu phong thỉnh thoảng xuất hiện toát lên vẻ lịch sử dày cộp.\n“Lâu đài này xây dựng khá tốt đấy!” Grimm khen ngợi một tiếng.\n“Có thể nhận được lời khen ngợi của Vu sư đại nhân là vinh hạnh của tôi!” Một giọng nói bình thản ôn hòa truyền tới. Grimm nhìn theo hướng phát ra âm thanh, đó là một người đàn ông trung niên đứng ở cổng lớn lâu đài, mặc một chiếc áo khoác lớn màu trắng nạm vàng.\nNgười đàn ông trung niên thấy ánh mắt of Grimm liền lập tức cúi đầu đi tới bên cạnh xe ngựa.\n“Thưa Vu sư đại nhân, hoan nghênh ngài tới thành Wither, đây là lãnh địa của tôi, tôi là Công tước của vùng này, ngài cứ gọi tôi là Ryan là được rồi!” Công tước tỏ vẻ vô cùng khiêm tốn, tươi cười nói.\n“Rất vui được gặp ngài, Công tước Ryan. Tôi là Vu sư trấn thủ nhiệm kỳ này của học viện, Grimm, 5 năm tiếp theo tôi sẽ trấn thủ ở nơi này!” Grimm nhạt giọng đáp lại.\n“Làm phiền Grimm đại nhân rồi, tôi đã chuẩn bị sẵn yến tiệc cho ngài, xin mời vào!” Ryan đưa tay mời Grimm.\nGrimm tự nhiên không từ chối, xuống xe ngựa giao xe cho binh lính, dặn dò bọn họ đừng động chạm lung tung, chỉ cần cho ngựa ăn cỏ khô là được, sau đó đi theo Ryan tiến vào lâu đài. Ngoại trừ Crado tiếp tục đi theo Công tước tiến vào lâu đài, đội vệ binh mở đường và tháp tùng trước đó đã giải tán ở lối vào lâu đài, trở về vị trí làm việc của mình. Vây quanh đội ngũ lúc này đã đổi thành một đám nữ hầu lớn.\nMột nhóm người tiến vào đại sảnh tiếp khách của lâu đài, Grimm liền phát hiện đại sảnh tiếp khách này rõ ràng đã được bố trí một cách tỉ mỉ.\nNền đất of đại sảnh lâu đài được lau chùi sạch sẽ không một hạt bụi, thậm chí có thể soi bóng mặt người. Một chiếc đèn chùm bằng vàng khổng lồ được treo ngay chính giữa đại sảnh, bên trên đặt đầy những viên huỳnh quang thạch đặc thù, chiếu sáng toàn bộ đại sảnh.\nBên cạnh đại sảnh còn có một ban nhạc chuyên nghiệp đang tấu lên những bản nhạc êm dịu, mang lại cho người ta cảm giác yên bình xa xăm.\nTrên bàn tiệc giữa đại sảnh bày đầy thức ăn phong phú, hương thịt và hương rượu tỏa ra ngào ngạt. Những chiếc bình rượu bằng bạc dưới ánh đèn chùm vàng phản chiếu ánh sáng lấp lánh ánh kim.\nSố lượng nữ hầu cực kỳ nhiều đứng ở các góc trong đại sảnh, sẵn sàng phục vụ thực khách bất cứ lúc nào.\nNgoài ra, còn có một nhóm người đứng ở giữa đại sảnh, xem chừng đều là gia quyến của Công tước, hoặc các quý tộc cùng nhân sự cốt cán khác trong lâu đài.\n“Grimm đại nhân, xin mời ngồi ghế thượng tọa!” Công tước Ryan cung kính mời Grimm vào bàn tiệc.\nGrimm vốn đã đi đường rất lâu, cũng muốn ăn một chút thức ăn bình thường, tự nhiên là vui vẻ ngồi vào chỗ.\nGrimm khi ăn cơm không thích nói chuyện, những người khác cũng không dám chủ động khơi gợi đề tài, bầu không khí trong phòng ăn có vẻ hơi trầm mặc. Grimm ngược lại vô cùng hưởng thụ, lúc thưởng thức mỹ vị thì không nên nói chuyện.\nCông tước Ryan nhìn Grimm đang tận hưởng đồ ăn ngon, sự bất an nơi đáy mắt khẽ giảm bớt một chút.\n[Vị Vu sư lần này xem ra dễ hầu hạ hơn vị trước nhiều!] Ryan nhìn Grimm, thầm đánh giá một câu.\n“Grimm đại nhân! Ngài có thể thu con làm đồ đệ được không?” Một giọng nói hơi non nớt vang lên, đánh vỡ sự im lặng của toàn bộ buổi tiệc.\nTất cả mọi người đều nhìn về phía nguồn phát ra âm thanh. Đó là một cô gái có mái tóc vàng dài, làn da trắng trẻo, thân hình đầy đặn, tuổi tác trông chừng mười lăm mười sáu tuổi.\nCông tước Ryan cùng những người lớn tuổi khác trong yến tiệc lập tức lộ ra vẻ mặt kinh hoàng. Là những người từng tiếp xúc với Vu sư, bọn họ biết tuyệt đại đa số các Vu sư đều coi thường người phàm bình thường. Người phàm tùy tiện bắt chuyện với Vu sư là một việc cực kỳ mạo hiểm.\n“Alicia, con đang nói bậy bạ gì thế? Mau xin lỗi Grimm đại nhân!” Một người phụ nữ trung niên có dáng người quyến rũ, gương mặt trưởng thành ngồi bên cạnh cô gái vội vàng kéo Alicia đứng lên, mặt mũi đầy vẻ hoảng sợ kéo Alicia không ngừng cúi đầu xin lỗi Grimm.\n“Tại sao lại muốn bái ta làm thầy?” Grimm đã ăn gần xong, cầm lấy khăn ăn bên cạnh lau miệng, hơi tò mò hỏi Alicia.\nNgay khi vừa bước vào bàn ăn, Grimm đã phát hiện ra sự bất thường của Alicia. Cô luôn phân vân lưỡng lự giữa việc nói hay không nói, mãi cho đến khi thấy Grimm sắp dùng xong bữa mới không thể không kiên trì đứng lên phát biểu.\nAlicia nghe thấy giọng nói của Grimm, trên mặt đầu tiên là thoáng qua vẻ hoảng loạn và khó xử, sau đó liền chuyển thành vui mừng.\n“Con...” Alicia vừa định nói ra nguyên nhân thì đột nhiên liếc mắt nhìn về phía Công tước, tiếp đó lại nhìn sang người phụ nữ bên cạnh vẫn đang cúi đầu, ánh mắt lập tức tối sầm lại. Nhưng sự do dự of Alicia chỉ diễn ra trong tích tắc, cô giống như đã hạ quyết tâm lớn, hít sâu một hơi.\n“Thưa Grimm đại nhân, con muốn nắm giữ vận mệnh của chính mình, không muốn làm vật hy sinh cho các cuộc liên hôn chính trị!” Ánh mắt Alicia đan xen giữa tuyệt vọng và hy vọng khi nói ra câu này.\nHiện tại vận mệnh của cô hầu như hoàn toàn giao cho Grimm quyết định. Một khi Grimm không can thiệp, kết cục cuối cùng của cô cùng gia đình cô là bị đuổi khỏi lâu đài.\nGrimm nhìn Alicia, giống như nhớ tới Ashville. Tại lãnh địa Nam tước, Ashville không ngừng tiếp cận hắn cũng là vì mục đích tương tự, không muốn trở thành vật hy sinh cho liên hôn chính trị.\n“Ta không thể thu ngươi làm đồ đệ, ngươi không hề có tư chất Vu sư!” Một câu nói của Grimm trực tiếp đánh thẳng Alicia xuống vực sâu vạn trượng. Đôi mắt vốn long lanh lấp lánh của cô trong nháy mắt trở nên u ám vô hồn. Toàn bộ tinh khí thần của cô như bị rút cạn sạch.\n“Không sao ạ... Cảm ơn Grimm đại nhân.” Alicia giống như khúc gỗ cứng đờ ngồi lại xuống ghế.\nCông tước trong buổi tiệc cũng khẽ thở phào nhẹ nhõm. Ông ta liếc nhìn Grimm một cái rồi nhìn Alicia bằng ánh mắt nguy hiểm.\n“Tuy nhiên, nếu ngươi sẵn sàng phối hợp làm thí nghiệm của ta, ta có thể bồi dưỡng ngươi thành một Đại kỵ sĩ!” Sau khi thỏa mãn ác thú vị trong lòng, Grimm đột nhiên lại lên tiếng.\nNhưng Alicia chịu đòn kích thích lớn giống như không nghe thấy lời Grimm nói, cả người đờ ra như tượng gỗ, ngơ ngác ngồi trên ghế. Cho đến khi người phụ nữ quý phái bên cạnh khẽ vỗ nhẹ vào má, cô mới hoàn hồn, vẻ mặt tràn đầy kinh ngạc lẫn mừng rỡ nhìn về phía Grimm.\n“Con nguyện ý! Con nguyện ý phối hợp với thí nghiệm của đại nhân!” Alicia kích động trả lời, còn không ngừng cúi đầu vái chào Grimm.\n“Thế thì tạm thời cứ như vậy đi, sau khi phòng thí nghiệm của ta dựng lên sẽ thông báo cho ngươi!” Grimm nhạt giọng nói.\nĐây không phải là quyết định bộc phát nhất thời của Grimm, mà là nghiên cứu hắn đã lên